id,title
1,sunt aut facere repellat provident occaecati excepturi optio reprehenderit
2,qui est esse
3,ea molestias quasi exercitationem repellat qui ipsa sit aut
4,eum et est occaecati
5,nesciunt quas odio
6,dolorem eum magni eos aperiam quia
7,magnam facilis autem
8,dolorem dolore est ipsam
9,nesciunt iure omnis dolorem tempora et accusantium
10,optio molestias id quia eum
11,et ea vero quia laudantium autem
12,in quibusdam tempore odit est dolorem
13,dolorum ut in voluptas mollitia et saepe quo animi
14,voluptatem eligendi optio
15,eveniet quod temporibus
16,sint suscipit perspiciatis velit dolorum rerum ipsa laboriosam odio
17,fugit voluptas sed molestias voluptatem provident
18,voluptate et itaque vero tempora molestiae
19,adipisci placeat illum aut reiciendis qui
20,doloribus ad provident suscipit at
21,asperiores ea ipsam voluptatibus modi minima quia sint
22,dolor sint quo a velit explicabo quia nam
23,maxime id vitae nihil numquam
24,autem hic labore sunt dolores incidunt
25,rem alias distinctio quo quis
26,est et quae odit qui non
27,quasi id et eos tenetur aut quo autem
28,delectus ullam et corporis nulla voluptas sequi
29,iusto eius quod necessitatibus culpa ea
30,a quo magni similique perferendis
31,ullam ut quidem id aut vel consequuntur
32,doloremque illum aliquid sunt
33,qui explicabo molestiae dolorem
34,magnam ut rerum iure
35,id nihil consequatur molestias animi provident
36,fuga nam accusamus voluptas reiciendis itaque
37,provident vel ut sit ratione est
38,explicabo et eos deleniti nostrum ab id repellendus
39,eos dolorem iste accusantium est eaque quam
40,enim quo cumque
41,non est facere
42,commodi ullam sint et excepturi error explicabo praesentium voluptas
43,eligendi iste nostrum consequuntur adipisci praesentium sit beatae perferendis
44,optio dolor molestias sit
45,ut numquam possimus omnis eius suscipit laudantium iure
46,aut quo modi neque nostrum ducimus
47,quibusdam cumque rem aut deserunt
48,ut voluptatem illum ea doloribus itaque eos
49,laborum non sunt aut ut assumenda perspiciatis voluptas
50,repellendus qui recusandae incidunt voluptates tenetur qui omnis exercitationem
